{
    "report": "# Relatório de Análise do Projeto\n\n## Visão Geral\n- Total de arquivos: 26\n- Total de linhas de código: 903\n- Total de funções: 0\n- Total de classes: 0\n\n## Linguagens Utilizadas\n- Unknown: 26 arquivo(s)\n\n## Arquivos Analisados\n- busca.txt: 3 linhas (Unknown)\n- README.md: 4 linhas (Unknown)\n- .git\\config: 13 linhas (Unknown)\n- .git\\description: 1 linhas (Unknown)\n- .git\\HEAD: 1 linhas (Unknown)\n- .git\\packed-refs: 2 linhas (Unknown)\n- .git\\hooks\\applypatch-msg.sample: 15 linhas (Unknown)\n- .git\\hooks\\commit-msg.sample: 24 linhas (Unknown)\n- .git\\hooks\\fsmonitor-watchman.sample: 174 linhas (Unknown)\n- .git\\hooks\\post-update.sample: 8 linhas (Unknown)\n- .git\\hooks\\pre-applypatch.sample: 14 linhas (Unknown)\n- .git\\hooks\\pre-commit.sample: 49 linhas (Unknown)\n- .git\\hooks\\pre-merge-commit.sample: 13 linhas (Unknown)\n- .git\\hooks\\pre-push.sample: 53 linhas (Unknown)\n- .git\\hooks\\pre-rebase.sample: 169 linhas (Unknown)\n- .git\\hooks\\pre-receive.sample: 24 linhas (Unknown)\n- .git\\hooks\\prepare-commit-msg.sample: 42 linhas (Unknown)\n- .git\\hooks\\push-to-checkout.sample: 78 linhas (Unknown)\n- .git\\hooks\\sendemail-validate.sample: 77 linhas (Unknown)\n- .git\\hooks\\update.sample: 128 linhas (Unknown)\n- .git\\info\\exclude: 6 linhas (Unknown)\n- .git\\logs\\HEAD: 1 linhas (Unknown)\n- .git\\logs\\refs\\heads\\main: 1 linhas (Unknown)\n- .git\\logs\\refs\\remotes\\origin\\HEAD: 1 linhas (Unknown)\n- .git\\refs\\heads\\main: 1 linhas (Unknown)\n- .git\\refs\\remotes\\origin\\HEAD: 1 linhas (Unknown)\n\n## Sugestões de Melhoria (IA)\n\nCom base nas informações fornecidas, aqui está uma análise geral do projeto e sugestões de melhoria:\n\n**1. Análise Geral do Projeto:**\n\nO projeto parece ser um repositório Git com um arquivo de busca (`busca.txt`) e um arquivo README.md.  A grande maioria dos arquivos listados são parte da estrutura interna do Git (.git), incluindo configurações, descrições, hooks (scripts executados em pontos específicos do fluxo de trabalho do Git), logs e referências.  A falta de informação sobre a linguagem de programação utilizada é um ponto fraco que dificulta uma análise mais aprofundada.\n\n**2. Pontos Fortes Identificados:**\n\n*   **Utilização do Git:** A presença da estrutura do Git indica que o projeto está sob controle de versão, o que é uma prática fundamental para colaboração, rastreamento de mudanças e rollback.\n\n*   **Existência de README.md:**  Um arquivo README.md, mesmo que pequeno (4 linhas), sugere uma intenção de fornecer alguma documentação básica sobre o projeto.\n\n**3. Sugestões de Melhoria Específicas:**\n\n*   **Identificar a Linguagem de Programação:**  O primeiro passo crucial é determinar a linguagem de programação utilizada no projeto (se houver).  Isso permitirá uma análise muito mais precisa e sugestões direcionadas.\n\n*   **Preencher o README.md:**  O arquivo README.md deve ser expandido para incluir:\n\n    *   Uma descrição clara do propósito do projeto.\n\n    *   Instruções sobre como configurar o ambiente e executar o projeto.\n\n    *   Exemplos de uso.\n\n    *   Informações sobre como contribuir.\n\n    *   Licença de uso.\n\n*   **Analisar e Configurar os Git Hooks:** Os arquivos `hooks` são scripts que podem automatizar tarefas no fluxo de trabalho do Git.  É importante analisar os hooks que são relevantes para o seu projeto e personalizá-los.  Exemplos:\n\n    *   `pre-commit`: Executar testes unitários, verificar o estilo de código ou validar a mensagem de commit.\n\n    *   `pre-push`: Impedir o envio de código que não passa em testes ou que contém erros de estilo.\n\n*   **Documentar o Código:** Se o projeto envolver código, adicione comentários claros e concisos para explicar o que o código faz e como ele funciona.\n\n**4. Recomendações de Boas Práticas:**\n\n**1. Boas Práticas de Programação:**\n\n*   **Padrões de Codificação:** Defina e siga um padrão de codificação consistente para melhorar a legibilidade e a manutenibilidade do código.  Ferramentas como ESLint (para JavaScript), Pylint (para Python) e linters similares para outras linguagens podem ajudar a impor esses padrões.\n\n*   **Testes Unitários:** Escreva testes unitários para garantir que cada componente do código funcione corretamente.  Isso ajuda a prevenir bugs e a facilitar a refatoração.\n\n*   **Controle de Versão:** Utilize o Git de forma eficaz, criando branches para novas funcionalidades, fazendo commits atômicos e escrevendo mensagens de commit descritivas.\n\n**2. Possíveis Problemas de Segurança:**\n\n*   **Não exponha informações confidenciais no repositório Git.** Isso inclui senhas, chaves de API e outras credenciais. Utilize variáveis de ambiente e arquivos de configuração separados para armazenar essas informações. Nunca commite esses arquivos no repositório.\n\n*   **Analise as dependências do projeto em busca de vulnerabilidades.** Utilize ferramentas como `npm audit` (para Node.js) ou `pip audit` (para Python) para identificar e corrigir vulnerabilidades conhecidas em suas dependências.\n\n*   **Sanitize a entrada do usuário.** Se o projeto recebe entrada do usuário, valide e sanitize essa entrada para evitar ataques como injeção de SQL ou Cross-Site Scripting (XSS).\n\n**3. Oportunidades de Otimização:**\n\n*   **Analise o desempenho do código.** Identifique gargalos de desempenho e otimize o código para melhorar a velocidade e a eficiência.\n\n*   **Utilize técnicas de caching.** Se o projeto envolve acesso a dados frequentes, utilize técnicas de caching para reduzir a carga no servidor e melhorar o tempo de resposta.\n\n*   **Minifique arquivos JavaScript e CSS.** Reduza o tamanho dos arquivos JavaScript e CSS para melhorar o tempo de carregamento da página.\n\n**4. Melhorias na Estrutura do Projeto:**\n\n*   **Organize o código em módulos ou pacotes lógicos.** Isso facilita a manutenção e a reutilização do código.\n\n*   **Utilize um sistema de gerenciamento de dependências.** Isso facilita a instalação e o gerenciamento das dependências do projeto.  Exemplos: `npm` (para JavaScript), `pip` (para Python), Maven (para Java).\n\n*   **Considere a utilização de um framework.** Frameworks como React, Angular (JavaScript), Django, Flask (Python), Spring Boot (Java) podem fornecer uma estrutura sólida para o projeto e acelerar o desenvolvimento.  A escolha do framework dependerá da linguagem de programação e dos requisitos do projeto.\n\n*   **Estrutura de Diretórios:** Crie uma estrutura de diretórios bem definida e consistente.  Exemplo:\n\n    ```\n\n    /\n\n    ├── README.md\n\n    ├── src/           # Código fonte principal\n\n    │   ├── components/ # Componentes reutilizáveis\n\n    │   ├── utils/      # Funções utilitárias\n\n    │   ├── ...\n\n    ├── tests/         # Testes unitários e de integração\n\n    ├── docs/          # Documentação do projeto\n\n    ├── config/        # Arquivos de configuração\n\n    ├── .gitignore      # Arquivos e diretórios a serem ignorados pelo Git\n\n    ├── package.json   # (Para projetos Node.js) Gerenciamento de dependências\n\n    └── ...\n\n    ```\n\n**Em resumo:**\n\nA análise inicial revela que o projeto precisa de mais informações para uma avaliação completa. Identificar a linguagem, detalhar o README e examinar os Git hooks são passos cruciais. Implementar boas práticas de programação, segurança e otimização, juntamente com uma estrutura de projeto organizada, melhorará significativamente a qualidade e a manutenibilidade do código.",
    "metrics": {
        "total_files": 26,
        "total_lines": 903,
        "total_functions": 0,
        "total_classes": 0,
        "languages": {
            "Unknown": 26
        },
        "files": [
            {
                "path": "busca.txt",
                "lines": 3,
                "language": "Unknown"
            },
            {
                "path": "README.md",
                "lines": 4,
                "language": "Unknown"
            },
            {
                "path": ".git\\config",
                "lines": 13,
                "language": "Unknown"
            },
            {
                "path": ".git\\description",
                "lines": 1,
                "language": "Unknown"
            },
            {
                "path": ".git\\HEAD",
                "lines": 1,
                "language": "Unknown"
            },
            {
                "path": ".git\\packed-refs",
                "lines": 2,
                "language": "Unknown"
            },
            {
                "path": ".git\\hooks\\applypatch-msg.sample",
                "lines": 15,
                "language": "Unknown"
            },
            {
                "path": ".git\\hooks\\commit-msg.sample",
                "lines": 24,
                "language": "Unknown"
            },
            {
                "path": ".git\\hooks\\fsmonitor-watchman.sample",
                "lines": 174,
                "language": "Unknown"
            },
            {
                "path": ".git\\hooks\\post-update.sample",
                "lines": 8,
                "language": "Unknown"
            },
            {
                "path": ".git\\hooks\\pre-applypatch.sample",
                "lines": 14,
                "language": "Unknown"
            },
            {
                "path": ".git\\hooks\\pre-commit.sample",
                "lines": 49,
                "language": "Unknown"
            },
            {
                "path": ".git\\hooks\\pre-merge-commit.sample",
                "lines": 13,
                "language": "Unknown"
            },
            {
                "path": ".git\\hooks\\pre-push.sample",
                "lines": 53,
                "language": "Unknown"
            },
            {
                "path": ".git\\hooks\\pre-rebase.sample",
                "lines": 169,
                "language": "Unknown"
            },
            {
                "path": ".git\\hooks\\pre-receive.sample",
                "lines": 24,
                "language": "Unknown"
            },
            {
                "path": ".git\\hooks\\prepare-commit-msg.sample",
                "lines": 42,
                "language": "Unknown"
            },
            {
                "path": ".git\\hooks\\push-to-checkout.sample",
                "lines": 78,
                "language": "Unknown"
            },
            {
                "path": ".git\\hooks\\sendemail-validate.sample",
                "lines": 77,
                "language": "Unknown"
            },
            {
                "path": ".git\\hooks\\update.sample",
                "lines": 128,
                "language": "Unknown"
            },
            {
                "path": ".git\\info\\exclude",
                "lines": 6,
                "language": "Unknown"
            },
            {
                "path": ".git\\logs\\HEAD",
                "lines": 1,
                "language": "Unknown"
            },
            {
                "path": ".git\\logs\\refs\\heads\\main",
                "lines": 1,
                "language": "Unknown"
            },
            {
                "path": ".git\\logs\\refs\\remotes\\origin\\HEAD",
                "lines": 1,
                "language": "Unknown"
            },
            {
                "path": ".git\\refs\\heads\\main",
                "lines": 1,
                "language": "Unknown"
            },
            {
                "path": ".git\\refs\\remotes\\origin\\HEAD",
                "lines": 1,
                "language": "Unknown"
            }
        ],
        "ai_suggestions": [
            "Com base nas informações fornecidas, aqui está uma análise geral do projeto e sugestões de melhoria:",
            "**1. Análise Geral do Projeto:**",
            "O projeto parece ser um repositório Git com um arquivo de busca (`busca.txt`) e um arquivo README.md.  A grande maioria dos arquivos listados são parte da estrutura interna do Git (.git), incluindo configurações, descrições, hooks (scripts executados em pontos específicos do fluxo de trabalho do Git), logs e referências.  A falta de informação sobre a linguagem de programação utilizada é um ponto fraco que dificulta uma análise mais aprofundada.",
            "**2. Pontos Fortes Identificados:**",
            "*   **Utilização do Git:** A presença da estrutura do Git indica que o projeto está sob controle de versão, o que é uma prática fundamental para colaboração, rastreamento de mudanças e rollback.",
            "*   **Existência de README.md:**  Um arquivo README.md, mesmo que pequeno (4 linhas), sugere uma intenção de fornecer alguma documentação básica sobre o projeto.",
            "**3. Sugestões de Melhoria Específicas:**",
            "*   **Identificar a Linguagem de Programação:**  O primeiro passo crucial é determinar a linguagem de programação utilizada no projeto (se houver).  Isso permitirá uma análise muito mais precisa e sugestões direcionadas.",
            "*   **Preencher o README.md:**  O arquivo README.md deve ser expandido para incluir:",
            "    *   Uma descrição clara do propósito do projeto.",
            "    *   Instruções sobre como configurar o ambiente e executar o projeto.",
            "    *   Exemplos de uso.",
            "    *   Informações sobre como contribuir.",
            "    *   Licença de uso.",
            "*   **Analisar e Configurar os Git Hooks:** Os arquivos `hooks` são scripts que podem automatizar tarefas no fluxo de trabalho do Git.  É importante analisar os hooks que são relevantes para o seu projeto e personalizá-los.  Exemplos:",
            "    *   `pre-commit`: Executar testes unitários, verificar o estilo de código ou validar a mensagem de commit.",
            "    *   `pre-push`: Impedir o envio de código que não passa em testes ou que contém erros de estilo.",
            "*   **Documentar o Código:** Se o projeto envolver código, adicione comentários claros e concisos para explicar o que o código faz e como ele funciona.",
            "**4. Recomendações de Boas Práticas:**",
            "**1. Boas Práticas de Programação:**",
            "*   **Padrões de Codificação:** Defina e siga um padrão de codificação consistente para melhorar a legibilidade e a manutenibilidade do código.  Ferramentas como ESLint (para JavaScript), Pylint (para Python) e linters similares para outras linguagens podem ajudar a impor esses padrões.",
            "*   **Testes Unitários:** Escreva testes unitários para garantir que cada componente do código funcione corretamente.  Isso ajuda a prevenir bugs e a facilitar a refatoração.",
            "*   **Controle de Versão:** Utilize o Git de forma eficaz, criando branches para novas funcionalidades, fazendo commits atômicos e escrevendo mensagens de commit descritivas.",
            "**2. Possíveis Problemas de Segurança:**",
            "*   **Não exponha informações confidenciais no repositório Git.** Isso inclui senhas, chaves de API e outras credenciais. Utilize variáveis de ambiente e arquivos de configuração separados para armazenar essas informações. Nunca commite esses arquivos no repositório.",
            "*   **Analise as dependências do projeto em busca de vulnerabilidades.** Utilize ferramentas como `npm audit` (para Node.js) ou `pip audit` (para Python) para identificar e corrigir vulnerabilidades conhecidas em suas dependências.",
            "*   **Sanitize a entrada do usuário.** Se o projeto recebe entrada do usuário, valide e sanitize essa entrada para evitar ataques como injeção de SQL ou Cross-Site Scripting (XSS).",
            "**3. Oportunidades de Otimização:**",
            "*   **Analise o desempenho do código.** Identifique gargalos de desempenho e otimize o código para melhorar a velocidade e a eficiência.",
            "*   **Utilize técnicas de caching.** Se o projeto envolve acesso a dados frequentes, utilize técnicas de caching para reduzir a carga no servidor e melhorar o tempo de resposta.",
            "*   **Minifique arquivos JavaScript e CSS.** Reduza o tamanho dos arquivos JavaScript e CSS para melhorar o tempo de carregamento da página.",
            "**4. Melhorias na Estrutura do Projeto:**",
            "*   **Organize o código em módulos ou pacotes lógicos.** Isso facilita a manutenção e a reutilização do código.",
            "*   **Utilize um sistema de gerenciamento de dependências.** Isso facilita a instalação e o gerenciamento das dependências do projeto.  Exemplos: `npm` (para JavaScript), `pip` (para Python), Maven (para Java).",
            "*   **Considere a utilização de um framework.** Frameworks como React, Angular (JavaScript), Django, Flask (Python), Spring Boot (Java) podem fornecer uma estrutura sólida para o projeto e acelerar o desenvolvimento.  A escolha do framework dependerá da linguagem de programação e dos requisitos do projeto.",
            "*   **Estrutura de Diretórios:** Crie uma estrutura de diretórios bem definida e consistente.  Exemplo:",
            "    ```",
            "    /",
            "    ├── README.md",
            "    ├── src/           # Código fonte principal",
            "    │   ├── components/ # Componentes reutilizáveis",
            "    │   ├── utils/      # Funções utilitárias",
            "    │   ├── ...",
            "    ├── tests/         # Testes unitários e de integração",
            "    ├── docs/          # Documentação do projeto",
            "    ├── config/        # Arquivos de configuração",
            "    ├── .gitignore      # Arquivos e diretórios a serem ignorados pelo Git",
            "    ├── package.json   # (Para projetos Node.js) Gerenciamento de dependências",
            "    └── ...",
            "    ```",
            "**Em resumo:**",
            "A análise inicial revela que o projeto precisa de mais informações para uma avaliação completa. Identificar a linguagem, detalhar o README e examinar os Git hooks são passos cruciais. Implementar boas práticas de programação, segurança e otimização, juntamente com uma estrutura de projeto organizada, melhorará significativamente a qualidade e a manutenibilidade do código."
        ]
    }
}